key,title,year,month,day,journal,issn,volume,issue,pages,authors,url,language,publisher,location,abstract,notes,doi,keywords,pubmed_id,pmc_id,PDF files,72193-RCT_primary_endpoint,72199-protocol_sample_size,72192-RCT_design_aim,72191-RCT_aim_trial,72194-RCT_sample_size,72198-protocol_primary_endpoint,72197-protocol_design_aim,72195-RCT_clinical_discussion_interpretation,72222-pretrial_document_type,72196-protocol_aim_trial,72200-final_publication_significant_results
rayyan-416562605,Randomized Controlled Clinical Trial for Mastectomy Skin Flaps: pre-Mammary Fascial Plane Versus a Thin Skin Flap Between Small and Large Fat Lobules and Flap Raised by Scalpel Versus Electrodiathermy,2024,,,,,86,2,385‐393,"Patel, S and Kataria, K and Ranjan, P and Dhar, A and Seenu, V and Pandey, RM and Srivastava, A",https://www.cochranelibrary.com/central/doi/10.1002/central/CN-02746470/full,,,,,"",10.1007/s12262-023-03885-y,Breast;Comparative Studies;Descriptive Statistics;Electrocoagulation;Fascia;Funding Source;Human;India;Mastectomy;Methods;Necrosis;Pathology;Postoperative Complications;Random Assignment;Randomized Controlled Trials;Risk Assessment;Risk Factors;Surgical Flaps;Surgical Instruments;Surgical Wound Infection;Treatment Outcomes,,,s12262-023-03885-y.pdf,"[{""text"":""Risk of mastectomy skin necrosis (MSN)""}]","[{""text"":""999""}]","[{""text"":""0""}]","[{""text"":""0""}]","[{""text"":""999""}]","[{""text"":""a)Flap Necrosis: It will be coded as present or absent b)Surgical site infection: It will be coded as present or absent c)Seroma: It will be coded as present or absent d)Hematoma: It will be coded as present or absent e)Blood loss in ml during flap raising and in first 24 hrs in drain fluid. f)Time taken for raising flaps g)Amount of drainage fluid in ml till drain is removed. h)Days with drain.""}]","[{""text"":""999""}]","[{""text"":""0""}]","[{""text"":""3""}]","[{""text"":""999""}]","[{""text"":""1""}]"
rayyan-416562606,Evaluating the impact of an anti‐microbial silver‐impregnated surgical dressing on wound infections and healing: a randomised clinical trial,2024,,,,,32,1,67‐73,"Whitley, A and Baláž, P and Kavalírek, J and Hanusová, J and Gürlich, R",https://www.cochranelibrary.com/central/doi/10.1002/central/CN-02745356/full,,,,,"",10.1111/wrr.13142,Abdomen;Antimicrobial Dressings;Descriptive Statistics;Evaluation;Funding Source;Human;Ionic Silver Dressings;Odds Ratio;Postoperative Care;Prevention and Control;Prospective Studies;Random Assignment;Randomized Controlled Trials;Surgery;Surgical Patients;Surgical Wound Care;Surgical Wound Infection;Treatment Outcomes;Wound Healing,,,WoundRepairmicrobial.pdf,"[{""text"":""999""}]","[{""text"":""999""}]","[{""text"":""0""}]","[{""text"":""999""}]","[{""text"":""999""}]","","","[{""text"":""999""}]","[{""text"":""999""}]","","[{""text"":""999""}]"
rayyan-416562608,A Randomised Controlled Study to Reduce the Incidence of Umbilical Port Site Complications in Laparoscopic Cholecystectomy Using Uniform Methods of Umbilical Hygiene,2024,,,,,86,6,1175‐1181,"Garg, R and Rathore, YS and Chumber, S and Kataria, K and Saini, V and Mohan, A",https://www.cochranelibrary.com/central/doi/10.1002/central/CN-02821329/full,,,,,"",10.1007/s12262-024-04033-w,"Adverse Effects;Bathing and Baths;Chlorhexidine;Cholecystectomy, Laparoscopic;Coconut Oil;Equipment and Supplies;Human;Hygiene;Incidence;Pathology;Postoperative Complications;Preoperative Care;Prevention and Control;Random Assignment;Randomized Controlled Trials;Surgical Patients;Surgical Wound Infection;Umbilicus",,,s12262-024-04033-w.pdf,"[{""text"":""999""}]","[{""text"":""999""}]","[{""text"":""0""}]","[{""text"":""1""}]","[{""text"":""999""}]","[{""text"":""1. Compare the incidence of port site hernia with and without the use of the standardized method of umbilical hygiene 2. Compare the incidence of port site infection with and without the use of the standardized method of umbilical hygiene 3. Compare the incidence of wound complication with and without the use of the standardized method of umbilical hygiene""}]","[{""text"":""999""}]","[{""text"":""0""}]","[{""text"":""3""}]","[{""text"":""999""}]","[{""text"":""0""}]"
rayyan-416562610,A Randomized Controlled Clinical Trial of N-Butyl Cyanoacrylate Glue Fixation Versus Tacker Fixation of Mesh in Endoscopic Totally Extraperitoneal Hernia Repair,2024,,,,,86,2,364‐369,"Bunkar, SK and Verma, K and Jhunjhunwala, A and Singh, A",https://www.cochranelibrary.com/central/doi/10.1002/central/CN-02824930/full,,,,,"",10.1007/s12262-021-03118-0,"Adult;Chronic Pain;Endoscopy;Hernia, Inguinal;Human;Male;Middle Age;Pain Measurement;Postoperative Pain;Prevention and Control;Random Assignment;Randomized Controlled Trials;Surgery;Surgery, Laparoscopic;Surgical Mesh;Surgical Patients;Therapeutic Use;Tissue Adhesives;Treatment Outcomes;Visual Analog Scaling",,,s12262-021-03118-0_kZy.pdf,"[{""text"":""Endpoints studied were recurrence at the end of 6 months, post-operative acute and chronic pain, analgesic requirement in the post-operative period, and duration of surgery.""}]","","[{""text"":""0""}]","[{""text"":""999""}]","[{""text"":""999""}]","","","[{""text"":""0""}]","[{""text"":""999""}]","","[{""text"":""0""}]"
rayyan-416562611,"Providing coffee in the PACU: impact on postoperative nausea and vomiting, patient satisfaction, and length of stay",2024,,,,,30,3,102‐103,"Kennedy, C and Dowdy, A and McQuillan-Emerson, H and Reinert, D and Ballhaus, B and Rogers, L and Baker, R",https://www.cochranelibrary.com/central/doi/10.1002/central/CN-02769616/full,,,,,"",,Adult;Coffee;Descriptive Statistics;Human;Length of Stay;Nausea and Vomiting;Outpatient Service;Patient Satisfaction;Post Anesthesia Care Units;Postoperative Care;Random Assignment;Randomized Controlled Trials;Surgical Patients,,,AMB-SURG-30-3-KENNEDY.pdf,"[{""text"":""999""}]","","[{""text"":""0""}]","[{""text"":""999""}]","[{""text"":""999""}]","","","[{""text"":""999""}]","[{""text"":""999""}]","","[{""text"":""0""}]"
rayyan-416562616,Short-term efficacy of laparoscopic type C radical hysterectomy by deep uterine vein approach for treatment of cervical cancer,2024,,,,,28,12,73‐81,"Juanpeng, Yu and Ting, Yu and Shengsheng, Yu and Yingchun, Gao",https://www.cochranelibrary.com/central/doi/10.1002/central/CN-02810632/full,,,,,"",10.29063/ajrh2024/v28i12.8,"Blood Loss, Surgical;Catheters;Cervix Neoplasms;Human;Hysterectomy;Lymph Nodes;Methods;Neoplasm Recurrence, Local;Postoperative Complications;Quality of Life;Randomized Controlled Trials;Surgery;Surgery, Laparoscopic;Treatment Outcomes;Uterus",,,5109-13267-2-PB.pdf,"[{""text"":""999""}]","","[{""text"":""0""}]","[{""text"":""999""}]","[{""text"":""999""}]","","","[{""text"":""999""}]","[{""text"":""999""}]","","[{""text"":""999""}]"
rayyan-416562621,Randomised Clinical Trial of Harmonic Scalpel Haemorrhoidectomy Versus Stapled Haemorrhoidopexy in grade III / IV Haemorrhoids,2024,,,,,86,3,540‐543,"Jyoti, K and Sharma, A and Rao, PP",https://www.cochranelibrary.com/central/doi/10.1002/central/CN-02764601/full,,,,,"",10.1007/s12262-023-03901-1,"Adolescence;Adult;Blood Loss, Surgical;Comparative Studies;Data Analysis Software;Decision Making, Clinical;Descriptive Statistics;Female;Hemorrhoidectomy;Hemorrhoids;Human;India;Job Re‐Entry;Male;Middle Age;Patient Discharge;Postoperative Complications;Postoperative Pain;Prevention and Control;Random Assignment;Randomized Controlled Trials;Recurrence;Surgery;Surgical Instruments;Treatment Duration;Treatment Outcomes;Visual Analog Scaling",,,s12262-023-03901-1_eAK.pdf,"[{""text"":""Following the surgical intervention, patient  was evaluated on the primary outcome measures, which  comprised of post operative pain assessment using Visual  Analogue Scale, requirement of analgesia (Time Frame: at  06 h, 24 h, 36 h & 72 h), and intra-operative blood loss  (weight of dry and wet Gauze piece).""}]","[{""text"":""999""}]","[{""text"":""0""}]","[{""text"":""999""}]","[{""text"":""999""}]","[{""text"":""Following the surgical intervention, patient  was evaluated on the primary outcome measures, which  comprised of post operative pain assessment using Visual  Analogue Scale, requirement of analgesia (Time Frame: at  06 h, 24 h, 36 h & 72 h), and intra-operative blood loss  (weight of dry and wet Gauze piece).""}]","[{""text"":""999""}]","[{""text"":""0""}]","[{""text"":""3""}]","[{""text"":""999""}]","[{""text"":""1""}]"
rayyan-416562625,O 臂导航辅助脊柱后路减压植骨融合内固定治疗 脊柱退行性疾病的临床研究,2024,,,,,33,12,93‐96,"孙敬争, and 贾学勤, and 张东芝, and 李丹丹, and 张丽, and 段伟利,",https://www.cochranelibrary.com/central/doi/10.1002/central/CN-02819389/full,,,,,"",10.13517/j.cnki.ccm.2024.12.021,"Blood Loss, Surgical;Bone Transplantation;China;Clinical Assessment Tools;Comparative Studies;Decompression, Surgical;Descriptive Statistics;Fluoroscopy;Fracture Fixation;Functional Assessment;Hospitals;Human;Length of Stay;Low Back Pain;Methods;Perioperative Care;Postoperative Complications;Random Assignment;Randomized Controlled Trials;Spinal Diseases;Surgery;Surgery, Elective;Surgical Patients;Treatment Duration;Treatment Outcomes;Visual Analog Scaling",,,Oarm_chinese.pdf,"[{""text"":""999""}]","","[{""text"":""0""}]","[{""text"":""999""}]","[{""text"":""999""}]","","","[{""text"":""999""}]","[{""text"":""999""}]","","[{""text"":""999""}]"
rayyan-416562627,Периопераційна профілактика інфекцій верхніх сечових шляхів у перкутанній хірургії нефролітіазу,2024,,,,,,3,16‐22,"Сагалевич, АІ and Ожогін, ВВ and Возіанов, ОС and Дубовий, ЯО and Постол, ЯМ and Никифорук, ОО and Наумчук, ОМ",https://www.cochranelibrary.com/central/doi/10.1002/central/CN-02819513/full,,,,,"",10.30841/2786-7323.3.2024.316655,"Administration and Dosage;Adverse Effects;Analysis;Antibiotic Prophylaxis;Antibiotics, Combined;Blood;Cefuroxime;Cephalosporins;Comparative Studies;C‐Reactive Protein;Descriptive Statistics;Device Removal;Drainage;Drug Efficacy;Evaluation;Fever;Human;Inpatients;Kidney Calculi;Length of Stay;Leukocytes;Lithotripsy;Patient Safety;Perioperative Care;Postoperative Care;Postoperative Complications;Postoperative Period;Prevention and Control;Random Assignment;Randomized Controlled Trials;Stents;Surgery;Surgical Patients;Surgical Wound Infection;Therapeutic Use;Tromethamine;Ukraine;Urinary Tract Infections;Urolithiasis",,,316655-Текст статті-752050-1-10-20250306.pdf,"[{""text"":""999""}]","","[{""text"":""0""}]","[{""text"":""999""}]","[{""text"":""999""}]","","","[{""text"":""999""}]","[{""text"":""999""}]","","[{""text"":""999""}]"
rayyan-416562644,Fixation of Conventional Polypropylene Mesh Versus Non-fixation of 3D Mesh in Laparoscopic Transabdominal Preperitoneal (TAPP) Inguinal Hernia Repair: a Randomized Controlled Trial,2024,,,,,86,4,786‐792,"Elghadban, H and Negm, A and Hisham, I and Elganash, AE and Taki-Eldin, A",https://www.cochranelibrary.com/central/doi/10.1002/central/CN-02784301/full,,,,,"",10.1007/s12262-023-03974-y,"Academic Medical Centers;Adult;Chronic Pain;Descriptive Statistics;Egypt;Female;Groin Pain;Hernia, Inguinal;Herniorrhaphy;Human;Length of Stay;Male;Methods;Middle Age;Peritoneum;Polyenes;Postoperative Complications;Postoperative Pain;Prevention and Control;Prospective Studies;Random Assignment;Randomized Controlled Trials;Surgery;Surgery, Laparoscopic;Surgical Mesh;Treatment Duration;Treatment Outcomes",,,s12262-023-03974-y.pdf,"[{""text"":""The primary outcome was the postoperative pain which was evaluated by  the visual analogue Scale (VAS) which is graded from  0 to 10, where 0 referred to no pain, 1–3 indicated mild  pain, 4–6 indicated moderate pain, and 7–10 indicated  severe pain.""}]","","[{""text"":""0""}]","[{""text"":""999""}]","[{""text"":""999""}]","","","[{""text"":""0""}]","[{""text"":""999""}]","","[{""text"":""1""}]"
rayyan-416562645,The Effectiveness of Vitamin C for Postoperative Pain Relief in Patients Undergoing Laparoscopic Cholecystectomy: a Prospective Randomized Double-blind Trial,2024,,,,,38,3,190‐194,"Bala, R and Saini, RM and Kiran, S and Bansal, P and Kshetrapal, K and Kataria, P",https://www.cochranelibrary.com/central/doi/10.1002/central/CN-02821361/full,,,,,"",10.4103/ijpn.ijpn_87_24,"Acetaminophen;Administration and Dosage;Adult;Adverse Effects;Analgesia;Ascorbic Acid;Cholecystectomy, Laparoscopic;Diclofenac;Double‐Blind Studies;Female;Human;Intraoperative Period;Ketorolac;Male;Methods;Middle Age;Normal Saline;Pain Management;Pain Measurement;Postoperative Pain;Postoperative Period;Prevention and Control;Prospective Studies;Random Assignment;Randomized Controlled Trials;Scales;Surgical Patients;Treatment Outcomes",,,the_effectiveness_of_vitamin_c_for_postoperative.6.pdf,"[{""text"":""The sample size was calculated on the basis of a previous  study[9] and the primary outcome was frequency of rescue  analgesia.""}]","","[{""text"":""0""}]","[{""text"":""999""}]","[{""text"":""0""}]","","","[{""text"":""0""}]","[{""text"":""999""}]","","[{""text"":""1""}]"
rayyan-416562647,Comparison of single absorbable tacker vs. conventional method in fixating the mesh in bilateral inguinal hernia undergoing laparoscopic transabdominal preperitoneal (TAPP): a randomized control trial study,2024,,,,,29,,1‐7,"Mohammad Sadeghi, PM and Naseri, AH and Shishegar, A and Melali, H and Ashjaei, A",https://www.cochranelibrary.com/central/doi/10.1002/central/CN-02746840/full,,,,,"",10.4103/jrms.jrms_161_23,"Activities of Daily Living;Adolescence;Adult;Aged;Aged, 80 and Over;Chi Square Test;Data Analysis Software;Descriptive Statistics;Female;Fibrin Tissue Adhesive;Funding Source;Hernia, Inguinal;Herniorrhaphy;Human;Iran;Laparoscopy;Length of Stay;Male;Mann‐Whitney U Test;Methods;Middle Age;Peritoneum;Postoperative Complications;Postoperative Pain;Postoperative Period;Prospective Studies;Quality of Life;Questionnaires;Random Assignment;Randomized Controlled Trials;Surgery;Surgical Mesh;Therapeutic Use;Treatment Duration;T‐Tests;Urinary Catheterization",,,comparisonof_single_absorbable_tackers.pdf,"[{""text"":""All patients were visited during the hospital stay and  1 month postoperatively to assess the surgical site infection,  seroma, hematoma, days to return to work and pain. Patients were monitored by telephone follow‑up in  6 months and 12 months after surgery regarding seroma,  hematoma, recurrence, neuralgia, and pain. If a patient  stated a complication in telephone follow‑up, an in‑person  examination was done. All data were recorded in a checklist  consisting of 32 multiple‑choice questions filled out by an  investigator. Eura‑Hs questionnaires were used to assess the QOL after  hernia surgery.[15,16] An investigator has filled out these two  by asking patients, 12 months after surgery.""}]","[{""text"":""999""}]","[{""text"":""0""}]","[{""text"":""999""}]","[{""text"":""999""}]","[{""text"":""All patients were visited during the hospital stay and  1 month postoperatively to assess the surgical site infection,  seroma, hematoma, days to return to work and pain. Patients were monitored by telephone follow‑up in  6 months and 12 months after surgery regarding seroma,  hematoma, recurrence, neuralgia, and pain. If a patient  stated a complication in telephone follow‑up, an in‑person  examination was done. All data were recorded in a checklist  consisting of 32 multiple‑choice questions filled out by an  investigator. Eura‑Hs questionnaires were used to assess the QOL after  hernia surgery.[15,16] An investigator has filled out these two  by asking patients, 12 months after surgery.""}]","[{""text"":""999""}]","[{""text"":""0""}]","[{""text"":""3""}]","[{""text"":""999""}]","[{""text"":""1""}]"
rayyan-416562663,Rescue analgesia with a transversus abdominis plane block alleviates moderate-to-severe pain and improves oxygenation after abdominal surgery: a randomized controlled trial,2024,,,,,,,1‐11,"Jingxian, He and Shuai, Qin and Yuwen, Wang and Qiuping, Ye and Penglei, Wang and Ye, Zhang and Yun, Wu",https://www.cochranelibrary.com/central/doi/10.1002/central/CN-02787038/full,,,,,"",10.3389/fpain.2024.1454665,"Abdomen;Academic Medical Centers;Administration and Dosage;Aged;Analgesia;Anesthetics, General;Arterial Pressure;Blood;China;Confidence Intervals;Cough;Data Analysis Software;Digestive System Physiology;Evaluation;Female;Funding Source;Human;Male;Mann‐Whitney U Test;Methods;Middle Age;Nerve Block;Oxygen;Oxygenation;Pain Measurement;Postoperative Care;Postoperative Pain;Prevention and Control;Random Assignment;Randomized Controlled Trials;Sample Size Determination;Scales;Sleep Quality;Surgery;Surgical Patients;Transversus Abdominis;Treatment Outcomes;T‐Tests;Wilcoxon Rank Sum Test",,,fpain_5_1454665.pdf,"[{""text"":""The primary outcome was the degree of pain relief on coughing 30 min after the administration of rescue analgesia.""}]","[{""text"":""999""}]","[{""text"":""0""}]","[{""text"":""999""}]","[{""text"":""0""}]","[{""text"":""The primary outcome was the degree of pain relief on coughing 30 min after the administration of rescue analgesia.""}]","[{""text"":""999""}]","[{""text"":""0""}]","[{""text"":""3""}]","[{""text"":""999""}]","[{""text"":""1""}]"
rayyan-416562665,A Randomized Comparative Study of Ultrasound-guided Femoral Nerve Block Versus Fascia Iliaca Compartment Block for Reducing Pain Associated with Positioning for Spinal Anesthesia in Patients with Proximal Femur Fracture,2024,,,,,38,2,104‐108,"Bansal, K and Khandelwal, M and Beniwal, S and Darshan, N and Bhat, S and Choudhary, R",https://www.cochranelibrary.com/central/doi/10.1002/central/CN-02832167/full,,,,,"",10.4103/ijpn.ijpn_57_23,"Administration and Dosage;Adult;Adverse Effects;Analgesia;Analgesics;Anesthesia, Spinal;Bupivacaine;Chi Square Test;Comparative Studies;Data Analysis Software;Descriptive Statistics;Drug Efficacy;Evaluation;Fascia;Female;Femoral Nerve;Fracture Fixation;Human;Ilium;Innervation;Length of Stay;Male;Methods;Middle Age;Nerve Block;Pain Management;Pain, Procedural;Patient Positioning;Patient Satisfaction;Postoperative Pain;Postoperative Period;Preoperative Period;Prevention and Control;Prospective Studies;Proximal Femoral Fractures;Random Assignment;Randomized Controlled Trials;Single‐Blind Studies;Surgery;Surgical Patients;Treatment Duration;T‐Tests;Ultrasonography;Visual Analog Scaling",,,a_randomized_comparative_study_of.pdf,"[{""text"":""The primary objective was to find out which nerve block was better in reducing pain associated  with a sitting position for spinal anesthesia.""}]","[{""text"":""999""}]","[{""text"":""0""}]","[{""text"":""999""}]","[{""text"":""0""}]","[{""text"":""999""}]","[{""text"":""999""}]","[{""text"":""0""}]","[{""text"":""3""}]","[{""text"":""999""}]","[{""text"":""1""}]"
rayyan-416562668,Comparing Remimazolam and Propofol for Postoperative Anesthesia Satisfaction in Outpatient Gynecological Surgery: a Randomized Clinical Trial,2024,,,,,18,,4615‐4627,"Wang, XL and Dai, LL and Li, YN and Zhang, JW and Qu, MC and Zhou, YY and Xing, N",https://www.cochranelibrary.com/central/doi/10.1002/central/CN-02766068/full,,,,,"",10.2147/DDDT.S483029,*Gynecologic Surgical Procedures;*Patient Satisfaction;*Propofol [administration & dosage];Adult;Ambulatory Surgical Procedures;Anesthesia;Benzodiazepines [administration & dosage];Female;Humans;Middle Aged,,,comparing_anesthe.pdf,"[{""text"":""The primary endpoint was the immediate postoperative anesthesia satisfaction score.""}]","[{""text"":""999""}]","[{""text"":""1""}]","[{""text"":""1""}]","[{""text"":""0""}]","[{""text"":""The primary endpoint was the immediate postoperative anesthesia satisfaction score.""}]","[{""text"":""999""}]","[{""text"":""0""}]","[{""text"":""3""}]","[{""text"":""999""}]","[{""text"":""1""}]"
rayyan-416562672,Randomized controlled trial comparing quadratus Lumborum Block and Surgical Site Infiltration in Total Abdominal Hysterectomy: efficacy Analysis,2024,,,,,38,3,171‐176,"Dhanger, S and Jayavani, RL and Vaidiyanathan, B and Rajesh, IJ",https://www.cochranelibrary.com/central/doi/10.1002/central/CN-02810628/full,,,,,"",10.4103/ijpn.ijpn_59_24,"Anesthesia, Spinal;Anesthetics, Local;Comparative Studies;Data Analysis Software;Descriptive Statistics;Evaluation;Female;Human;Hysterectomy;Methods;Middle Age;Nerve Block;Pain Management;Patient Satisfaction;Postoperative Pain;Quadratus Lumborum Muscles;Random Assignment;Randomized Controlled Trials;Sleep Disorders;Treatment Outcomes",,,quad.pdf,"[{""text"":""The primary objective  is to evaluate the analgesia duration between both groups,  defined as the interval from block performance to the first  report of a Verbal Analog Scale (VAS) score ≥4.""}]","[{""text"":""999""}]","[{""text"":""0""}]","[{""text"":""999""}]","[{""text"":""0""}]","[{""text"":""The primary objective  is to evaluate the analgesia duration between both groups,  defined as the interval from block performance to the first  report of a Verbal Analog Scale (VAS) score ≥4.""}]","[{""text"":""999""}]","[{""text"":""0""}]","[{""text"":""3""}]","[{""text"":""999""}]","[{""text"":""0""}]"
rayyan-416562686,颈椎管狭窄 ACCF 与颈后路椎管扩大减压的效果对比,2024,,,,,33,8,108‐112,"郑朋飞, and 邱锴, and 张宾, and 梁晓飞,",https://www.cochranelibrary.com/central/doi/10.1002/central/CN-02769304/full,,,,,"",10.13517/j.cnki.ccm.2024.08.024,"Cervical Vertebrae;Chemokines;China;Decompression, Surgical;Descriptive Statistics;Evaluation;Hospitals;Human;Inflammation;Interleukins;Length of Stay;Pathology;Patient Safety;Postoperative Complications;Prevention and Control;Random Assignment;Randomized Controlled Trials;Recovery;Severity of Illness Indices;Spinal Canal;Spinal Curvatures;Spinal Fusion;Spinal Stenosis;Surgery;Treatment Duration;Treatment Outcomes;Visual Analog Scaling",,,Comparison_posterior _spinal_stenosis.pdf,"[{""text"":""999""}]","","[{""text"":""0""}]","[{""text"":""999""}]","[{""text"":""999""}]","","","[{""text"":""0""}]","[{""text"":""999""}]","","[{""text"":""999""}]"
rayyan-416562688,Effects of White Noise on Pain Scores and Salivary Cortisol Levels in Surgical Neonates: a Randomized Controlled Trial,2024,,,,,24,3,291‐300,"Siya, Lin and Li, Li and Xuyan, Ren and Chunxia, Zhong and Kai, Wu and Xiaoling, Fang and Shaocong, Liang and Xuedong, Chen and Jingxia, Chen and Liucheng, Yang and et al.",https://www.cochranelibrary.com/central/doi/10.1002/central/CN-02746594/full,,,,,"",10.1097/ANC.0000000000001167,"Analysis;Chi Square Test;China;Data Analysis Software;Descriptive Statistics;Female;Funding Source;Human;Hydrocortisone;In Infancy and Childhood;Infant, Newborn;Male;Mann‐Whitney U Test;Noise;Pain Measurement;Postoperative Pain;Prevention and Control;Psychosocial Factors;Random Assignment;Randomized Controlled Trials;Saliva;Scales;Statistical Significance;Surgical Patients;Treatment Outcomes;T‐Tests;Wilcoxon Rank Sum Test",,,effects_of_white_noise_on_pain_scores_and_salivary_ylo.pdf,"[{""text"":""The primary outcome was pain scores measured by the COMFORTneo Scale (Supplemental Table 1 available at http://links.lww.com/ANC/A268).""}]","[{""text"":""999""}]","[{""text"":""0""}]","[{""text"":""999""}]","[{""text"":""1""}]","[{""text"":""The primary outcome was pain scores measured by the COMFORTneo Scale (Supplemental Table 1 available at http://links.lww.com/ANC/A268).""}]","[{""text"":""999""}]","[{""text"":""0""}]","[{""text"":""3""}]","[{""text"":""999""}]","[{""text"":""0""}]"
rayyan-416562690,The Effect of Foot Reflexology on Pain and Kinesiophobia in Patients Following Total Knee Arthroplasty A Double-Blind Randomized Controlled Study,2024,,,,,43,4,223‐233,"Özbaş, N and Şahan, N and Aydın, E",https://www.cochranelibrary.com/central/doi/10.1002/central/CN-02753528/full,,,,,"",10.1097/NOR.0000000000001043,"Aged;Analysis of Covariance;Arthroplasty, Replacement, Knee;Chi Square Test;Comparative Studies;Data Analysis Software;Descriptive Statistics;Double‐Blind Studies;Female;Fisher's Exact Test;Foot;Human;Kinesiophobia;Male;Mann‐Whitney U Test;Middle Age;Physiology;Postoperative Pain;Psychosocial Factors;Random Assignment;Randomized Controlled Trials;Reflexology;Scales;Surgical Patients;Turkey;Visual Analog Scaling",,,foot_felex.pdf,"[{""text"":""999""}]","","[{""text"":""0""}]","[{""text"":""999""}]","[{""text"":""0""}]","","","[{""text"":""999""}]","[{""text"":""999""}]","","[{""text"":""999""}]"
rayyan-416562696,四磨汤口服液治疗腹部手术后促进胃肠功能恢复的 随机、双盲、安慰剂对照、多中心临床试验,2024,,,,,42,10,28‐32,"肖羽, and 程丹桂, and 刘兴国, and 高军, and 李延林, and 袁增江, and 刘东文, and 杨华,",https://www.cochranelibrary.com/central/doi/10.1002/central/CN-02784222/full,,,,,"",10.13193/j.issn.1673-7717.2024.10.007,"Abdomen;Administration and Dosage;Administration, Oral;Comparative Studies;Descriptive Statistics;Digestive System Physiology;Double‐Blind Studies;Drug Efficacy;Drugs, Chinese Herbal;Evaluation;Gastrointestinal Motility;Human;Multicenter Studies;Patient Safety;Postoperative Care;Random Assignment;Randomized Controlled Trials;Recovery;Solutions;Surgery;Surgical Patients;Time;Treatment Duration",,,四磨汤口服液治疗腹部手术后促进胃肠功能恢复的随机、双盲、安慰剂对照、多中心临床试验 (1).pdf,"[{""text"":""999""}]","","[{""text"":""0""}]","[{""text"":""999""}]","[{""text"":""999""}]","","","[{""text"":""999""}]","[{""text"":""999""}]","","[{""text"":""999""}]"
