key,title,year,month,day,journal,issn,volume,issue,pages,authors,url,language,publisher,location,abstract,notes,doi,keywords,pubmed_id,pmc_id,PDF files,72193-RCT_primary_endpoint,72199-protocol_sample_size,72192-RCT_design_aim,72191-RCT_aim_trial,72194-RCT_sample_size,72198-protocol_primary_endpoint,72197-protocol_design_aim,72195-RCT_clinical_discussion_interpretation,72222-pretrial_document_type,72196-protocol_aim_trial,72200-final_publication_significant_results
rayyan-416563051,Minimally invasive sacrohysteropexy versus vaginal hysterectomy with uterosacral ligament suspension for pelvic organ prolapse: a prospective randomized non-inferiority trial,2024,,,,,31,5,406‐413,"Hwang, WY and Jeon, MJ and Suh, DH",https://www.cochranelibrary.com/central/doi/10.1002/central/CN-02664587/full,,,,,"",10.1016/j.jmig.2024.01.018,"*Hysterectomy, Vaginal [methods];*Laparoscopy [methods];*Ligaments [surgery];*Pelvic Organ Prolapse [surgery];*ligament;*non‐inferiority trial;*pelvic organ prolapse;*suspension;*vaginal hysterectomy;Adult;Aged;Article;Blood Loss, Surgical;Controlled study;Daily life activity;Drug therapy;Female;Follow up;Hospitalization;Human;Humans;Length of Stay;Major clinical study;Middle Aged;Minimally Invasive Surgical Procedures [methods];Operation duration;Operative Time;Pain intensity;Pelvic Organ Prolapse Quantification;Postoperative Complications [epidemiology, etiology];Postoperative complication;Prospective Studies;Quality of Life;Quality of life;Randomized controlled trial;Recurrence;Recurrent disease;Retreatment;Robotic Surgical Procedures [methods];Surgery;Treatment Outcome;Uterus prolapse",,,minim_gL8.pdf,"[{""text"":""The primary outcome was prolapse recurrence 1 year after surgery.""}]","[{""text"":""999""}]","[{""text"":""1""}]","[{""text"":""1""}]","[{""text"":""0""}]","[{""text"":""The primary outcome was prolapse recurrence 1 year after surgery.""}]","[{""text"":""999""}]","[{""text"":""0""}]","[{""text"":""3""}]","[{""text"":""999""}]","[{""text"":""1""}]"
rayyan-416563052,Clinical and biological effects of different energetic surgical devices currently used for mini-invasive anatomical lung resections for the treatment of NSCLC: a prospective interventional study,2024,,,,,38,8,4753‐4761,"Catelli, C and D'Alessandro, M and Mathieu, F and Addamo, E and Franchi, F and Paladini, P and Luzzi, L",https://www.cochranelibrary.com/central/doi/10.1002/central/CN-02727234/full,,,,,"",10.1007/s00464-024-11014-3,"*Carcinoma, Non‐Small‐Cell Lung [surgery];*Lung Neoplasms [pathology, surgery];*Pneumonectomy [instrumentation, methods];*Thoracic Surgery, Video‐Assisted [methods];*biological activity;*inflammation;*intervention study;*lobectomy;*non small cell lung cancer;*pneumonectomy;*surgical equipment;*video assisted thoracoscopic surgery;Adult;Aged;Article;Bipolar disorder;Complication;Controlled study;Cytokines [metabolism];Duration;Female;Heart arrhythmia;Hemoglobin blood level;Hospitalization;Human;Humans;Incidence;Length of Stay [statistics & numerical data];Major clinical study;Male;Middle Aged;Operative Time;Pain;Pain, Postoperative [etiology];Pleura fluid;Postoperative Complications [epidemiology, etiology];Postoperative complication;Postoperative pain;Prospective Studies;Randomized controlled trial;Surgery;Surgical technique;Therapy;Ultrasound;Video assisted thoracoscopic lobectomy",,,sss_11.pdf,"[{""text"":""999""}]","","[{""text"":""0""}]","[{""text"":""999""}]","[{""text"":""999""}]","","","[{""text"":""999""}]","[{""text"":""999""}]","","[{""text"":""999""}]"
rayyan-416563053,"Effect of Continuous Erector Spinae Plane Block on Postoperative Recovery in Patients Undergoing Minimally Invasive Cardiac Surgery: a Prospective, Randomized Controlled Clinical Trial",2024,,,,,44,6,1103‐1112,"Jin, L and Yu, Y and Miao, P and Huang, YH and Yu, SQ and Guo, KF",https://www.cochranelibrary.com/central/doi/10.1002/central/CN-02792763/full,,,,,"",10.1007/s11596-024-2593-4,"*Cardiac Surgical Procedures [adverse effects];*Minimally Invasive Surgical Procedures [methods];*Nerve Block [methods];*Pain, Postoperative [drug therapy];*analgesia;*analgesic activity;*heart surgery;*minimally invasive cardiac surgery;*pain;*postoperative analgesia;Adult;Aged;Analgesia, Patient‐Controlled [methods];Article;Chronic pain;Continuous infusion;Controlled study;Coughing;Double blind procedure;Double‐Blind Method;Female;General anesthesia;Human;Humans;Incidence;Intravenous drug administration;Major clinical study;Male;Middle Aged;Middle aged;Paraspinal Muscles [innervation];Postoperative pain;Prospective Studies;Randomized controlled trial;Special situation for pharmacovigilance;Sufentanil [administration & dosage, therapeutic use];Surgery;Visual analog scale",,,srte_e.pdf,"[{""text"":""The objective of this prospective randomized,  double-blind, placebo-controlled trial was to measure  the quality of recovery (QoR-15 score) as the primary outcome in patients who underwent elective minimally  invasive cardiac surgery as an exploration and a foundation for future trials.""}]","[{""text"":""999""}]","[{""text"":""0""}]","[{""text"":""999""}]","[{""text"":""0""}]","[{""text"":""The objective of this prospective randomized,  double-blind, placebo-controlled trial was to measure  the quality of recovery (QoR-15 score) as the primary outcome in patients who underwent elective minimally  invasive cardiac surgery as an exploration and a foundation for future trials.""}]","[{""text"":""999""}]","[{""text"":""1""}]","[{""text"":""3""}]","[{""text"":""999""}]","[{""text"":""1""}]"
rayyan-416563054,REDUCED INCISIONAL HERNIA INCIDENCE AFTER COLORECTAL CANCER SURGERY- THE REIN4CETO1 RANDOMIZED CONTROLLED TRIAL,2024,,,,,111,,v30,"Wenzelberg, CL",https://www.cochranelibrary.com/central/doi/10.1002/central/CN-02710914/full,,,,,"",10.1093/bjs/znae122.106,*cancer surgery;*colorectal cancer;*incidence;*incisional hernia;Adult;Complication;Conference abstract;Controlled study;Female;Human;Incision;Major clinical study;Middle aged;Polydioxanone suture;Polypropylene suture;Postoperative complication;Radiotherapy;Randomized controlled trial;Stoma;Surgery;Surgical infection;Surgical site;Suture technique,,,znae265 (1).pdf,"[{""text"":""The primary aim was to compare the CT-diagnosed incidence of  incisional hernia at 12 ± 3 months after surgery between the  study groups.""}]","[{""text"":""999""}]","[{""text"":""0""}]","[{""text"":""999""}]","[{""text"":""0""}]","[{""text"":""The primary aim was to compare the CT-diagnosed incidence of  incisional hernia at 12 ± 3 months after surgery between the  study groups.""}]","[{""text"":""999""}]","[{""text"":""0""}]","[{""text"":""3""}]","[{""text"":""999""}]","[{""text"":""1""}]"
rayyan-416563061,COMPARISON OF OPEN AND ARTHROSCOPIC SURGICAL MANAGEMENT FOR RECURRENT ANTERIOR SHOULDER INSTABILITY: a PROSPECTIVE STUDY,2024,,,,,15,2,2019‐2025,"Gupta, KL and Singh, VK",https://www.cochranelibrary.com/central/doi/10.1002/central/CN-02772076/full,,,,,"",10.4807/jcdr.2024.15.02.235,*arthroscopic surgery;*intermethod comparison;*open surgery;*recurrent shoulder dislocation /rehabilitation /surgery;Abduction;Adult;Article;Clinical evaluation;Cohort analysis;Constant Murley (score);Controlled study;Demographics;Female;Follow up;Human;Major clinical study;Male;Operation duration;Patient‐reported outcome;Peroperative complication;Postoperative care;Prospective study;Range of motion;Recurrence risk;Rotation;Treatment duration,,,eeeeee.pdf,"[{""text"":""999""}]","","[{""text"":""0""}]","[{""text"":""999""}]","[{""text"":""999""}]","","","[{""text"":""999""}]","[{""text"":""999""}]","","[{""text"":""999""}]"
rayyan-416563063,To Compare the Pain-Relieving Effectiveness of Butorphanol and Fentanyl in Different Surgical Procedures,2024,,,,,16,3,452‐455,"Nikita, and Bharti, S and Prasad, S",https://www.cochranelibrary.com/central/doi/10.1002/central/CN-02850204/full,,,,,"",,*pain;*surgical technique;Adult;Adverse drug reaction;Analgesia;Analgesic activity;Article;Asthma;Bihar;Chronic obstructive lung disease;Controlled study;Double blind procedure;Drug combination;Drug comparison;Duration;Female;General anesthesia;Human;Hypertension;Ischemic heart disease;Lung tuberculosis;Major clinical study;Male;Narcotic dependence;Postoperative analgesia;Prevention;Randomized controlled trial;Sedation;Side effect;Surgery;Valvular heart disease;Visual analog scale,,,"IJCPR,Vol16,Issue3,Article86.pdf","[{""text"":""999""}]","","[{""text"":""0""}]","[{""text"":""999""}]","[{""text"":""999""}]","","","[{""text"":""999""}]","[{""text"":""999""}]","","[{""text"":""999""}]"
rayyan-416563071,Can Verbal Interview Decrease Preoperative Anxiety and Postoperative Discomfort in Oral and Maxillofacial Surgery Patients?: a Randomized Clinical Trial,2024,,,,,82,11,1425‐1432,"Kocaturk, S and Gur, ZB and Gursoytrak, B",https://www.cochranelibrary.com/central/doi/10.1002/central/CN-02729040/full,,,,,"",10.1016/j.joms.2024.06.178,"*Anxiety [prevention & control];*Oral Surgical Procedures [psychology];*Pain, Postoperative [prevention & control, psychology];*anxiety;*interview;*maxillofacial surgery;*surgical patient;Adult;Article;Complication;Controlled study;Emotional disorder;Exposure variable;Female;Gag reflex;General anesthesia;Human;Humans;Major clinical study;Male;Marriage;Mental disease;Middle Aged;Nausea and vomiting;Pain Measurement;Patient Education as Topic [methods];Postoperative nausea;Postoperative pain;Postoperative vomiting;Preoperative Care [methods];Prospective Studies;Randomized controlled trial;Sex difference;State Trait Anxiety Inventory;Surgery;Visual analog scale;Vomiting;Young Adult",,,1-s2.0-S0278239124005883-main.pdf,"[{""text"":""The primary outcome variable was preoperative anxiety.""}]","","[{""text"":""0""}]","[{""text"":""999""}]","[{""text"":""0""}]","","","[{""text"":""0""}]","[{""text"":""999""}]","","[{""text"":""1""}]"
rayyan-416563072,Effect of flow-optimized pressure control ventilation-volume guaranteed (PCV-VG) on postoperative pulmonary complications: a consort study,2024,,,,,19,1,425,"Sun, TT and Chen, KX and Tao, Y and Zhang, GW and Zeng, L and Lin, M and Huang, J and Hu, Y",https://www.cochranelibrary.com/central/doi/10.1002/central/CN-02725041/full,,,,,"",10.1186/s13019-024-02881-x,"*One‐Lung Ventilation [methods];*Postoperative Complications [prevention & control];Aged;Female;Humans;Lung Diseases [etiology, physiopathology, prevention & control];Lung [physiopathology];Male;Middle Aged;Prospective Studies;Thoracic Surgical Procedures [adverse effects, methods]",,,s13019-024-02881-x.pdf,"[{""text"":""The primary outcomes measurements were incidence  of atelectasis immediately after surgery.""}]","[{""text"":""999""}]","[{""text"":""999""}]","[{""text"":""0""}]","[{""text"":""0""}]","[{""text"":""Postoperative Pulmonary Complication""}]","[{""text"":""999""}]","[{""text"":""0""}]","[{""text"":""3""}]","[{""text"":""999""}]","[{""text"":""0""}]"
rayyan-416563073,Cognitive Training to Reduce Memory Disturbance Associated With Postoperative Cognitive Impairment After Elective Noncardiac Surgery: an Experimental Study,2024,,,,,39,4,558‐566,"Ros-Nebot, B and Rodiera-Olivé, J and Verdera-Roig, M and Tril-Queralt, C and Pradas-Abadía, A and Julián-González, S and Falcó-Pegueroles, A",https://www.cochranelibrary.com/central/doi/10.1002/central/CN-02691246/full,,,,,"",10.1016/j.jopan.2023.10.016,"*Elective Surgical Procedures [adverse effects, methods];*Memory Disorders [prevention & control];*Postoperative Cognitive Complications [prevention & control];*anesthesia;*cognition;*cognitive defect;*cognitive rehabilitation;*experimental study;*memory;*nurse;*postoperative cognitive dysfunction;*training;Adult;Aged;Article;Artificial Intelligence;Artificial intelligence;Artificial intelligence software;Cognitive Dysfunction;Cognitive Training;Cognitive reserve;Comorbidity;Female;Human;Humans;Major clinical study;Male;Memory disorder;Middle Aged;Preoperative exercise;Screening test;Spain;Therapy",,,1-s2.0-S1089947223010250-main.pdf,"[{""text"":""999""}]","","[{""text"":""0""}]","[{""text"":""999""}]","[{""text"":""999""}]","","","[{""text"":""999""}]","[{""text"":""999""}]","","[{""text"":""999""}]"
rayyan-416563077,Transcutaneous electrical nerve stimulation for reducing postoperative acute pain after hip fracture surgery: a double-blinded randomized clinical trial,2024,,,,,28,7,2788‐2796,"Oksar, M and Kalaci, A and Turhanoglu, S",https://www.cochranelibrary.com/central/doi/10.1002/central/CN-02691395/full,,,,,"",10.26355/eurrev_202404_35907,"*Acute Pain [drug therapy];*Hip Fractures [surgery];*Surgical Wound;*Transcutaneous Electric Nerve Stimulation [methods];Analgesics, Opioid [therapeutic use];Double‐Blind Method;Humans;Pain, Postoperative [drug therapy, prevention & control]",,,2788-2796.pdf,"[{""text"":""Outcome parameters in this study, the primary  outcome was analgesic effectiveness, measured  using the VAS scores, and total opioid analgesic  consumption.""}]","[{""text"":""999""}]","[{""text"":""0""}]","[{""text"":""999""}]","[{""text"":""999""}]","[{""text"":""Postoperative pain intensity is assessed using VAS for pain postoperatively at 48h""}]","[{""text"":""999""}]","[{""text"":""999""}]","[{""text"":""3""}]","[{""text"":""999""}]","[{""text"":""999""}]"
rayyan-416563080,A family intervention to prevent postoperative delirium in patients undergoing cardiac valve surgery: a randomized controlled study,2024,,,,,63,,1‐8,"Lin, L and Peng, Y and Huang, X and Li, S and Chen, L and Lin, Y",https://www.cochranelibrary.com/central/doi/10.1002/central/CN-02612309/full,,,,,"",10.1016/j.hrtlng.2023.09.002,"*Cardiac Surgical Procedures [adverse effects];*Delirium [etiology, prevention & control];*Emergence Delirium [complications];*family therapy;*heart valve surgery;*postoperative delirium /therapy;Adult;Anxiety;Article;Artificial ventilation;Caregiver;Controlled study;Depression;Family;Female;Heart Valves [surgery];Human;Humans;Incidence;Intensive care unit;Major clinical study;Male;Middle aged;Outcome assessment;Postoperative Complications [etiology, prevention & control];Randomized controlled trial;Safety;Satisfaction;Single blind procedure;Single‐Blind Method",,,1-s2.0-S0147956323002303-main.pdf,"[{""text"":""The primary outcome was the incidence of delirium during the first 7  days post-surgery.""}]","[{""text"":""999""}]","[{""text"":""0""}]","[{""text"":""999""}]","[{""text"":""0""}]","[{""text"":""The primary outcome was the incidence of delirium during the first 7  days post-surgery.""}]","[{""text"":""999""}]","[{""text"":""1""}]","[{""text"":""3""}]","[{""text"":""999""}]","[{""text"":""1""}]"
rayyan-416563084,Patient Satisfaction with Nonopioid Postoperative Analgesia in Head and Neck Surgery: a Prospective Randomized Trial,2024,,,,,171,5,1426‐1432,"Perez, HA and Pannu, JS and Frank, E and Adebowale, A and Hebert, S and Watson, W and Lao, W and Tian, S and Kidd, S and Lee, S and et al.",https://www.cochranelibrary.com/central/doi/10.1002/central/CN-02766078/full,,,,,"",10.1002/ohn.885,"*Acetaminophen [therapeutic use];*Analgesics, Non‐Narcotic [therapeutic use];*Ibuprofen [therapeutic use];*Pain, Postoperative [drug therapy];*Patient Satisfaction;Adult;Aged;Ambulatory Surgical Procedures;Analgesics, Opioid [therapeutic use];Drug Combinations;Female;Head and Neck Neoplasms [surgery];Humans;Hydrocodone [therapeutic use];Male;Middle Aged;Pain Measurement;Prospective Studies",,,Otolaryngol --head neck surg - 2024 - Perez - Patient Satisfaction with Nonopioid Postoperative Analgesia in Head and Neck.pdf,"[{""text"":""The primary outcome measure for the study was patient satisfaction as noted in the PAIN OUT""}]","[{""text"":""999""}]","[{""text"":""999""}]","[{""text"":""0""}]","[{""text"":""0""}]","[{""text"":""The primary outcome measure for the study was patient satisfaction as noted in the PAIN OUT""}]","[{""text"":""999""}]","[{""text"":""1""}]","[{""text"":""3""}]","[{""text"":""999""}]","[{""text"":""0""}]"
rayyan-416563085,ASSESSMENT OF POSTOPERATIVE ANALGESIC EFFECT OF RECTUS SHEATH BLOCK IN GYNECOLOGICAL LAPAROSCOPIC SURGERY,2024,,,,,36,3,621‐624,"Irum, S and Saleem, S and Bano, A and Irum, S and Fatima, K",https://www.cochranelibrary.com/central/doi/10.1002/central/CN-02785182/full,,,,,"",10.55519/JAMC-03-13719,"*Anesthetics, Local [administration & dosage, therapeutic use];*Bupivacaine [administration & dosage, therapeutic use];*Gynecologic Surgical Procedures [methods];*Laparoscopy [methods];*Nerve Block [methods];*Pain, Postoperative [drug therapy];Adult;Double‐Blind Method;Female;Humans;Middle Aged;Pain Measurement;Prospective Studies;Rectus Abdominis [innervation, surgery]",,,"jmanager,+32-Sobia+Irum.pdf","[{""text"":""999""}]","","[{""text"":""0""}]","[{""text"":""999""}]","[{""text"":""999""}]","","","[{""text"":""999""}]","[{""text"":""999""}]","","[{""text"":""999""}]"
rayyan-416563088,Efficacy of aromatherapy with Lavandula angustifolia oil on postoperative pain after cardiac surgery: a randomized clinical trial,2024,,,,,20,6,103034,"Silva, LCMA and Dos Santos, KVG and Dos Santos, JJS and Camara, RPPOA and Bezerra, E Silva SY and Silva, HMMD and Ribeiro, KRB and Dantas, DV and Dantas, RAN",https://www.cochranelibrary.com/central/doi/10.1002/central/CN-02781883/full,,,,,"",10.1016/j.explore.2024.103034,"*Aromatherapy [methods];*Cardiac Surgical Procedures [adverse effects, methods];*Lavandula;*Oils, Volatile [therapeutic use];*Pain, Postoperative [drug therapy, therapy];*Plant Oils [administration & dosage, therapeutic use];Administration, Inhalation;Adult;Aged;Female;Humans;Male;Middle Aged;Pain Measurement;Single‐Blind Method;Sleep [drug effects]",,,aaaaa_BrH.pdf,"[{""text"":""999""}]","[{""text"":""999""}]","[{""text"":""0""}]","[{""text"":""999""}]","[{""text"":""1""}]","[{""text"":""Pain relief after inhaling the essential oil of Lavandula angustifolia is observed through the reduction of scores in the following scales: Visual Numerical Scale - EVN; Visual Analog Scale – VAS; Pain Assessment Scale - Wong Baker, in patients after cardiac surgery. The scale to be chosen will depend on the specific patient""}]","[{""text"":""999""}]","[{""text"":""1""}]","[{""text"":""3""}]","[{""text"":""999""}]","[{""text"":""999""}]"
rayyan-416563089,Effects of opioid-sparing general anesthesia on postoperative nausea and vomiting in laparoscopic gynecological surgery,2024,,,,,77,6,605‐613,"Nam, SW and Do, SH and Hwang, JW and Park, I and Hwang, I and Na, HS",https://www.cochranelibrary.com/central/doi/10.1002/central/CN-02747424/full,,,,,"",10.4097/kja.24336,"*Analgesics, Opioid [administration & dosage];*Anesthesia, General [adverse effects, methods];*Gynecologic Surgical Procedures [adverse effects, methods];*Laparoscopy [adverse effects, methods];*Postoperative Nausea and Vomiting [epidemiology, prevention & control];*Remifentanil [administration & dosage];*analgesia;*analgesic activity;*general anesthesia;*gynecologic surgery;*laparoscopy;*postoperative nausea and vomiting;*postoperative pain;Adult;Adverse drug reaction;Alfentanil [administration & dosage];Article;Controlled study;Drug therapy;Endotracheal intubation;Female;Hemodynamics;Hospitalization;Human;Humans;Incidence;Intravenous drug administration;Major clinical study;Male;Middle Aged;Middle aged;Nausea;Pain, Postoperative [etiology, prevention & control];Postoperative nausea;Prevention;Prospective Studies;Randomized controlled trial;Recovery room;Side effect;Single drug dose;Therapy;Vital sign",,,opiod_L7c.pdf,"[{""text"":""The primary outcome measure was the incidence of PONV.""}]","[{""text"":""999""}]","[{""text"":""0""}]","[{""text"":""999""}]","[{""text"":""0""}]","[{""text"":""The primary outcome measure was the incidence of PONV.""}]","[{""text"":""999""}]","[{""text"":""0""}]","[{""text"":""3""}]","[{""text"":""999""}]","[{""text"":""0""}]"
rayyan-416563091,Comparison of Thoracic Epidural and Paravertebral Block for Postoperative Pain Control in Patients with Thoracotomy,2024,,,,,35,2,41‐44,"Imran, M and Din, B and Ehsan, Z and Hameed, J and Khattak, AH and Baseer, A",https://www.cochranelibrary.com/central/doi/10.1002/central/CN-02691877/full,,,,,"",10.60110/medforum.350209,*intermethod comparison;*nerve block;*postoperative analgesia;*thoracic epidural analgesia;*thoracic paravertebral block;*thoracotomy;Adult;American Society of Anaesthesiologists score;Article;Bradycardia;Bronchiectasis /diagnosis /surgery;Controlled study;Echography;Epidural analgesia;Epidural space;Female;Headache;Human;Hypotension;Interstitial lung disease /diagnosis /surgery;Lung cancer /diagnosis /surgery;Lung hydatid cyst /diagnosis /surgery;Major clinical study;Male;Patient satisfaction;Pinprick test;Pleura thickening /diagnosis /surgery;Pneumonectomy;Postoperative complication;Postoperative nausea and vomiting;Postoperative pain /drug therapy;Pruritus;Randomized controlled trial;Respiration depression;Side effect;Surgical patient;Surgical technique;Sweating;Visual analog scale,,,thoracoto.pdf,"[{""text"":""999""}]","","[{""text"":""0""}]","[{""text"":""999""}]","[{""text"":""999""}]","","","[{""text"":""999""}]","[{""text"":""999""}]","","[{""text"":""999""}]"
rayyan-416563092,"Morphine (10, 20 mg) in a Postoperative Dressing Used with Patients After Surgical Debridement of Burn Wounds: a Prospective, Double-Blinded, Randomized Controlled Trial",2024,,,,,13,3,115‐122,"Kowalski, G and Domagalska, M and Slowinski, K and Grochowicka, M and Zawadzki, M and Kropinska, S and Leppert, W and Wieczorowska-Tobis, K",https://www.cochranelibrary.com/central/doi/10.1002/central/CN-02649705/full,,,,,"",10.1089/wound.2023.0037,"*Burns [therapy];*Morphine [therapeutic use];Adult;Analgesics, Opioid [therapeutic use];Bandages;Debridement;Humans;Pain;Prospective Studies",,,kowalski-et-al-2023-morphine-(10-20-mg)-in-a-postoperative-dressing-used-with-patients-after-surgical-debridement-of.pdf,"[{""text"":""999""}]","","[{""text"":""0""}]","[{""text"":""999""}]","[{""text"":""0""}]","","","[{""text"":""999""}]","[{""text"":""999""}]","","[{""text"":""999""}]"
rayyan-416563099,Efficacy of a Multimodal Surgical Site Injection for Postoperative Pain Control in Pediatric Patients With Cerebral Palsy Undergoing Hip Reconstruction: a Randomized Controlled Trial,2024,,,,,44,10,e921‐e928,"Greig, D and Sun, CA and McBride, D and Young, B and Klomhaus, A and Swaroop, VT and Thompson, RM",https://www.cochranelibrary.com/central/doi/10.1002/central/CN-02739616/full,,,,,"",10.1097/BPO.0000000000002779,"*Cerebral Palsy [complications, surgery];*Ketorolac [administration & dosage, therapeutic use];*Pain, Postoperative [drug therapy, etiology];*Ropivacaine [administration & dosage];*cerebral palsy;*hip surgery;*pediatric patient;*postoperative pain;*surgical site;Adolescent;Adult;Adverse drug reaction;Analgesia;Anesthetics, Local [administration & dosage];Anti‐Inflammatory Agents, Non‐Steroidal [administration & dosage, therapeutic use];Article;Blood transfusion;Child;Child, Preschool;Clinical article;Comorbidity;Complication;Controlled study;Double blind procedure;Double‐Blind Method;Drug Therapy, Combination;Drug therapy;Epinephrine [administration & dosage];Female;Gross Motor Function Classification System;Hip Dislocation [surgery];Hip dysplasia;Hospital discharge;Human;Humans;Immobilization;Injection site;Injections;Intravenous drug administration;Length of stay;Male;Operation duration;Oral drug administration;Osteotomy [methods];Pain Management [methods];Pain Measurement;Physiotherapy;Postoperative care;Postoperative period;Proximal femur;Radiographic parameter;Randomized controlled trial;Surgery;Treatment Outcome;Varus derotation osteotomy",,,efficacy_of_a_multimodal_surgical_site_injection.15.pdf,"[{""text"":""The primary outcome measure was narcotic consumption, converted into morphine equivalents per kilogram (mEQ/kg) (Table 1).""}]","[{""text"":""999""}]","[{""text"":""0""}]","[{""text"":""999""}]","[{""text"":""1""}]","[{""text"":""The primary outcome measure was narcotic consumption, converted into morphine equivalents per kilogram (mEQ/kg) (Table 1).""}]","[{""text"":""999""}]","[{""text"":""1""}]","[{""text"":""3""}]","[{""text"":""999""}]","[{""text"":""1""}]"
