key,authors,title,year,doi,pretrial_document_type,RCT_aim_trial,protocol_aim_trial,RCT_design_aim,protocol_design_aim,RCT_primary_endpoint,protocol_primary_endpoint,RCT_sample_size,protocol_sample_size,RCT_clinical_discussion_interpretation,final_publication_significant_results,condordance_aim,consensus_aim_trial,consensus_design_aim,condordance_design_aim,condordance_primary_endpoint,condordance_sample_size,outcome
rayyan-416563356,"Xu, HT and Zimmerman, J and Bertoch, T and Chen, L and Chen, PJ and Onel, E","CPL-01, an investigational long-acting ropivacaine, demonstrates safety and efficacy in open inguinal hernia repair",2024,10.1007/s10029-024-03047-3,3,999,999,0,999,The primary efficacy endpoint was  the mean area under the curve (AUC) of the NRS-A pain  intensity scores from 0–72 h (AUC0-72) of CPL-01 compared  to pooled placebo.,The primary efficacy endpoint was  the mean area under the curve (AUC) of the NRS-A pain  intensity scores from 0–72 h (AUC0-72) of CPL-01 compared  to pooled placebo.,999,999,1,0,0,999,0,999,1,999,0
rayyan-416563497,"Tierney, J and Harrison, E and Hodge, JC and Carney, AS",Coblation versus BiZact extra-capsular tonsillectomy in adults: a randomized control trial,2024,10.1111/ans.19007,3,1,999,0,0,Pain scores were collected for 14 days postoperatively using a 10 cm linear visual analogue pain scale (VAS) in which participants marked their average pain each day postoperatively from ‘no pain’ to ‘pain as bad as it could possibly be’ (Doc S1).,Pain scores were collected for 14 days postoperatively using a 10 cm linear visual analogue pain scale (VAS) in which participants marked their average pain each day postoperatively from ‘no pain’ to ‘pain as bad as it could possibly be’ (Doc S1).,0,1,1,999,1,1,0,0,1,2,0
rayyan-416563507,"Volkov, SN and Pushkar, DYu and Kolontarev, KB and Stepanchenko, VS and Tereshchenko, VI and Dzharimok, AR and Shevyakina, AE and Daurov, MA",The severity of lower urinary tract symptoms during the postoperative period as a factor in choosing an approach to surgical treatment for large prostate hyperplasia: holmium enucleation of the prostate (HoLEP) vs laparoscopic simple prostatectomy,2024,10.21886/2308-6424-2024-12-2-5-14,999,999,NA,0,NA,999,NA,999,NA,999,999,NA,NA,NA,NA,NA,NA,0
rayyan-416563552,"Lv, X and Hou, A and Han, S and Cao, J and Lou, J and Li, H and Min, S and Tan, H and Li, S and Lv, F and et al.",Effect of perioperative rehabilitation exercise on postoperative outcomes in patients aged ≥65 years undergoing gastrointestinal surgery: a multicenter randomized controlled trial,2024,10.1016/j.jclinane.2024.111670,3,999,999,0,999,"The primary outcome was the Comprehensive Complications Index (CCI), which integrates the severity of all postoperative complications on a continuous scale ranging from 0 (no complications) to 100 (death due to complications).","The primary outcome was the Comprehensive Complications Index (CCI), which integrates the severity of all postoperative complications on a continuous scale ranging from 0 (no complications) to 100 (death due to complications).",0,999,1,1,0,999,0,999,1,0,0
rayyan-416563556,"Calabrese, M and Arlotta, G and Antoniucci, ME and Montini, L and Giannarelli, D and Taccheri, T and Corsi, F and De Paulis, S and Scapigliati, A and Bevilacqua, F and et al.",Flurbiprofen in the subglottic space to prevent postoperative sore throat after cardiac surgery: a randomized double-blind study,2024,10.1016/j.jclinane.2024.111418,3,999,999,0,999,The primary outcome of the study was to evaluate the effect of  topical flurbiprofen administered through the subglottic port of the  tracheal tube to prevent post-operative sore throat (POST).,The primary outcome of the study was to evaluate the effect of  topical flurbiprofen administered through the subglottic port of the  tracheal tube to prevent post-operative sore throat (POST).,0,999,0,1,0,999,0,999,1,0,0
rayyan-416563591,"Urhan, G and Demirel, I and Deniz, A and Aksu, A and Altun, AY and Bolat, E and Bestas, A and Altuntas, G",Comparison of Dynamic Measures in Intraoperative Goal-Directed Fluid Therapy of Patients with Morbid Obesity Undergoing Laparoscopic Sleeve Gastrectomy,2024,10.1007/s11695-024-07154-z,999,999,NA,0,NA,999,NA,999,NA,999,999,NA,NA,NA,NA,NA,NA,0
rayyan-416563640,"Virdi, GS and Bansal, K and Singh, M and Anmol, and Singh, J and Bahadur, R",To Assess The Efficacy Of Intrawound Application Of Vancomycin Powder With Systemic Cefuroxime (Postoperatively) On Post Operative Wound Infection In Spine Surgery With Metallic Implant Fixation,2024,NA,999,999,NA,0,NA,999,NA,999,NA,999,999,NA,NA,NA,NA,NA,NA,0
rayyan-416564055,"Lv, H and Jiang, X and Huang, X and Wang, W and Wu, B and Yu, S and Lan, Z and Zhang, L and Lao, Y and Guo, J and et al.",Nitroglycerin versus milrinone for low central venous pressure in patients undergoing laparoscopic hepatectomy: a double-blinded randomized controlled trial,2024,10.1186/s12871-024-02631-5,3,999,999,0,999,The primary outcome was the difference in blood loss  between the milrinone group and the nitroglycerin group  during the surgery.,"Intraoperative blood loss, Allogeneic blood transfusion, Grade of surgical field",1,999,0,1,0,999,0,999,2,1,0
rayyan-416564056,"Mammo, TN and Feyssa, MD and Nofal, MR and Gebeyehu, N and Shiferaw, MA and Tesfaye, A and Fikre, T and Woldeamanuel, H and Alemu, SB and Miller, K and et al.",A Perioperative Quality Improvement Program for Cesarean Delivery in Ethiopia: a Stepped-Wedge Cluster Randomized Clinical Trial,2024,10.1001/jamanetworkopen.2024.28910,2,999,999,0,0,The primary end point of the trial was SSI within 30 days of CD,The primary end point of the trial was SSI within 30 days of CD,0,0,0,0,0,999,0,999,1,0,0
rayyan-416564057,"Elshazly, WG and Abo Elros, MA and Ali, AS and Radwan, AM",Randomized Controlled Trial to Compare Stapled Hemorrhoidopexy Plus Ligation Anopexy With Stapled Hemorrhoidopexy for Managing Grade III and IV Hemorrhoidal Disease,2024,10.1097/DCR.0000000000003273,3,999,999,0,999,"The primary outcome measures were hemorrhoidal  disease recurrence, quality of life, and satisfaction after a  minimum of 2 years of follow-up",999,0,999,0,1,0,999,0,999,1,0,0
